{
  "$schema": "http://json-schema.org/schema#",
  "type": "object",
  "properties": {
    "count": {
      "type": "integer"
    },
    "next": {
      "type": [
        "null",
        "string"
      ]
    },
    "previous": {
      "type": [
        "null",
        "string"
      ]
    },
    "results": {
      "type": "array",
      "items": {
        "$ref": "/schema/v2/api_resource.json"
      }
    }
  },
  "required": [
    "count",
    "next",
    "previous",
    "results"
  ]
}