{
  "count": 11,
  "next": null,
  "previous": null,
  "results": [
    {
      "name": "kanto",
      "url": "/api/v2/region/1/"
    },
    {
      "name": "johto",
      "url": "/api/v2/region/2/"
    },
    {
      "name": "hoenn",
      "url": "/api/v2/region/3/"
    },
    {
      "name": "sinnoh",
      "url": "/api/v2/region/4/"
    },
    {
      "name": "unova",
      "url": "/api/v2/region/5/"
    },
    {
      "name": "kalos",
      "url": "/api/v2/region/6/"
    },
    {
      "name": "alola",
      "url": "/api/v2/region/7/"
    },
    {
      "name": "galar",
      "url": "/api/v2/region/8/"
    },
    {
      "name": "hisui",
      "url": "/api/v2/region/9/"
    },
    {
      "name": "paldea",
      "url": "/api/v2/region/10/"
    },
    {
      "name": "orre",
      "url": "/api/v2/region/11/"
    }
  ]
}