{
  "count": 30,
  "next": null,
  "previous": null,
  "results": [
    {
      "url": "/api/v2/characteristic/1/"
    },
    {
      "url": "/api/v2/characteristic/2/"
    },
    {
      "url": "/api/v2/characteristic/3/"
    },
    {
      "url": "/api/v2/characteristic/4/"
    },
    {
      "url": "/api/v2/characteristic/5/"
    },
    {
      "url": "/api/v2/characteristic/6/"
    },
    {
      "url": "/api/v2/characteristic/7/"
    },
    {
      "url": "/api/v2/characteristic/8/"
    },
    {
      "url": "/api/v2/characteristic/9/"
    },
    {
      "url": "/api/v2/characteristic/10/"
    },
    {
      "url": "/api/v2/characteristic/11/"
    },
    {
      "url": "/api/v2/characteristic/12/"
    },
    {
      "url": "/api/v2/characteristic/13/"
    },
    {
      "url": "/api/v2/characteristic/14/"
    },
    {
      "url": "/api/v2/characteristic/15/"
    },
    {
      "url": "/api/v2/characteristic/16/"
    },
    {
      "url": "/api/v2/characteristic/17/"
    },
    {
      "url": "/api/v2/characteristic/18/"
    },
    {
      "url": "/api/v2/characteristic/19/"
    },
    {
      "url": "/api/v2/characteristic/20/"
    },
    {
      "url": "/api/v2/characteristic/21/"
    },
    {
      "url": "/api/v2/characteristic/22/"
    },
    {
      "url": "/api/v2/characteristic/23/"
    },
    {
      "url": "/api/v2/characteristic/24/"
    },
    {
      "url": "/api/v2/characteristic/25/"
    },
    {
      "url": "/api/v2/characteristic/26/"
    },
    {
      "url": "/api/v2/characteristic/27/"
    },
    {
      "url": "/api/v2/characteristic/28/"
    },
    {
      "url": "/api/v2/characteristic/29/"
    },
    {
      "url": "/api/v2/characteristic/30/"
    }
  ]
}